{"algorithm":"typaxis.machine-list-manifest/1","contract":"typaxis.contract/1.2","flow_registry_sha256":"7d2e41ca2ca9d301b01de7962da5d38c68dd942bcd5a28420c36d69ea32add2d","items":[{"block_offset":0,"content_inline_size":74,"content_physical_left":23,"first_line_block_size":8,"first_line_fragment_id":0,"first_line_inline_size":20,"fragment_ids":[0],"item_flow_id":1,"item_index":0,"item_node_id":2,"list_flow_id":0,"list_node_id":1,"marker_column_width":8,"marker_fragment_id":0,"marker_inline_size":4,"marker_key":{"generation_kind":"list_marker","owner":2,"owner_local_ordinal":0},"marker_physical_left":9,"marker_utf8":"9.","page_index":1},{"block_offset":0,"content_inline_size":50,"content_physical_left":21,"first_line_block_size":8,"first_line_fragment_id":1,"first_line_inline_size":18,"fragment_ids":[1],"item_flow_id":2,"item_index":0,"item_node_id":5,"list_flow_id":1,"list_node_id":4,"marker_column_width":6,"marker_fragment_id":1,"marker_inline_size":6,"marker_key":{"generation_kind":"list_marker","owner":5,"owner_local_ordinal":0},"marker_physical_left":5,"marker_utf8":"•","page_index":2},{"block_offset":0,"content_inline_size":74,"content_physical_left":23,"first_line_block_size":8,"first_line_fragment_id":2,"first_line_inline_size":24,"fragment_ids":[2],"item_flow_id":3,"item_index":1,"item_node_id":7,"list_flow_id":0,"list_node_id":1,"marker_column_width":8,"marker_fragment_id":2,"marker_inline_size":8,"marker_key":{"generation_kind":"list_marker","owner":7,"owner_local_ordinal":0},"marker_physical_left":5,"marker_utf8":"10.","page_index":3}],"list_flows":[{"end_indent":3,"item_frame_inline_size":74,"list_flow_id":0,"list_node_id":1,"marker_column_width":8,"marker_gap":10,"start_indent":5},{"end_indent":3,"item_frame_inline_size":50,"list_flow_id":1,"list_node_id":4,"marker_column_width":6,"marker_gap":10,"start_indent":5}],"marker_usage_sha256":"d88d4331ffdeded05484883194fbc4c7531a8ed9b80bb08cac653250550a8e6c","package_sha256":"16db2d62605168ac9a2b2aec474044b019b8cd7360d6fc444684633baead1064","page_count":4,"pdf_content_sha256":"82ea8a146cd1ea5a29997eae4c20daf4a8d3e836228382317b996863f78f8dc5","pdf_observation_sha256":"c15c6bfcc03dd71ace12d158ce0929a4ffa49bf1a530d4cdb914b275ae016181","policy_version":"typaxis.basic-list-policy/1"}
